<?xml version="1.0" encoding="ISO-8859-1"?>

<!-- 
    * Copyright (c) 2018 Airbus Operations S.A.S                                  *
    *                                                                             *
    * This program and the accompanying materials are made available under the    *
    * terms of the Eclipse Public License v. 2.0 which is available at            *
    * http://www.eclipse.org/legal/epl-2.0, or the Eclipse Distribution License   *
    * v. 1.0 which is available at                                                *
    * http://www.eclipse.org/org/documents/edl-v10.php.                           *
    *                                                                             *
    * SPDX-License-Identifier: EPL-2.0 OR BSD-3-Clause                            *
-->

<VirtualComponent xmlns:ex="http://airbus.com/modelingandsimulation/vsim/extension" xmlns:xsi="http://www.w3.org/2001/XMLSchema-instance" Name="GoodVirtualComponent" xsi:noNamespaceSchemaLocation="ims_config.xsd">
  <Equipment Name="firstEquipment">
    <Application Name="firstApplication">
      <DataExchange>
        <AFDX>
          <ProducedData>
            <SamplingMessage Name="AFDX_S_O" LocalName="LOCAL_AFDX1_S_O" MessageSizeBytes="42" ValidityDurationUs="50000" />
            <QueuingMessage Name="AFDX_Q_O" LocalName="LOCAL_AFDX1_Q_O" MaxSizeBytes="42" QueueDepth="2" />
          </ProducedData>
          <ConsumedData>
            <QueuingMessage Name="AFDX_S_I" LocalName="LOCAL_AFDX2_S_I" MaxSizeBytes="42" QueueDepth="2" />
            <SamplingMessage Name="AFDX_Q_I" LocalName="LOCAL_AFDX2_Q_I" MessageSizeBytes="42" ValidityDurationUs="50000" />
          </ConsumedData>
        </AFDX>
      </DataExchange>
    </Application>
  </Equipment>
</VirtualComponent>
