<?xml version="1.0" encoding="ISO-8859-1"?>

<!-- 
    * Copyright (c) 2018 Airbus Operations S.A.S                                  *
    *                                                                             *
    * This program and the accompanying materials are made available under the    *
    * terms of the Eclipse Public License v. 2.0 which is available at            *
    * http://www.eclipse.org/legal/epl-2.0, or the Eclipse Distribution License   *
    * v. 1.0 which is available at                                                *
    * http://www.eclipse.org/org/documents/edl-v10.php.                           *
    *                                                                             *
    * SPDX-License-Identifier: EPL-2.0 OR BSD-3-Clause                            *
-->

<VirtualComponent xmlns:ex="http://airbus.com/modelingandsimulation/vsim/extension" xmlns:xsi="http://www.w3.org/2001/XMLSchema-instance" Name="testVirtualComponent" xsi:noNamespaceSchemaLocation="ims_config.xsd">
  <Equipment Name="firstEquipment">
    <Application Name="firstApplication">
      <DataExchange>
        <CAN>
          <ProducedData>
            <Bus Name="firstEquipment_firstApplication_CAN_OUT_bus1">
              <SamplingMessage DefaultId="1F" LocalName="bus1_m1" MessageSizeBytes="4" ValidityDurationUs="50000" />
              <SamplingMessage DefaultId="20" LocalName="bus1_m2" MessageSizeBytes="8" ValidityDurationUs="60000" />
            </Bus>
            <Bus Name="firstEquipment_firstApplication_CAN_OUT_bus2">
              <SamplingMessage DefaultId="10" LocalName="bus2_m1" MessageSizeBytes="8" ValidityDurationUs="60000" />
              <SamplingMessage DefaultId="30" LocalName="bus2_m2" MessageSizeBytes="4" ValidityDurationUs="50000" />
            </Bus>
          </ProducedData>
        </CAN>
      </DataExchange>
    </Application>
  </Equipment>
</VirtualComponent>
