<?xml version="1.0" encoding="ISO-8859-1"?>

<!-- 
    * Copyright (c) 2018 Airbus Operations S.A.S                                  *
    *                                                                             *
    * This program and the accompanying materials are made available under the    *
    * terms of the Eclipse Public License v. 2.0 which is available at            *
    * http://www.eclipse.org/legal/epl-2.0, or the Eclipse Distribution License   *
    * v. 1.0 which is available at                                                *
    * http://www.eclipse.org/org/documents/edl-v10.php.                           *
    *                                                                             *
    * SPDX-License-Identifier: EPL-2.0 OR BSD-3-Clause                            *
-->

<VirtualComponent xmlns:ex="http://airbus.com/modelingandsimulation/vsim/extension" xmlns:xsi="http://www.w3.org/2001/XMLSchema-instance" Name="testVirtualComponent" xsi:noNamespaceSchemaLocation="ims_config.xsd">
  <Equipment Name="firstEquipment">
    <Application Name="firstApplication">
      <DataExchange>
        <NAD>
          <ConsumedData>
            <Message Name="grp1_nad1" LocalName="message1" MessageSizeBytes="4" />
            <Message Name="grp1_nad2" LocalName="message2" MessageSizeBytes="1" />
            <Message Name="grp2_nad1" LocalName="message3" MessageSizeBytes="8" />
            <Message Name="grp2_nad2" LocalName="message4" MessageSizeBytes="10" />
          </ConsumedData>
          <ProducedData>
            <Message Name="output_message" LocalName="output_message" MessageSizeBytes="4" PeriodUs="50000" />
          </ProducedData>
        </NAD>
      </DataExchange>
    </Application>
  </Equipment>
</VirtualComponent>
