<?xml version="1.0" encoding="ISO-8859-1"?>

<!-- 
    * Copyright (c) 2018 Airbus Operations S.A.S                                  *
    *                                                                             *
    * This program and the accompanying materials are made available under the    *
    * terms of the Eclipse Public License v. 2.0 which is available at            *
    * http://www.eclipse.org/legal/epl-2.0, or the Eclipse Distribution License   *
    * v. 1.0 which is available at                                                *
    * http://www.eclipse.org/org/documents/edl-v10.php.                           *
    *                                                                             *
    * SPDX-License-Identifier: EPL-2.0 OR BSD-3-Clause                            *
-->

<VirtualComponent xmlns:ex="http://airbus.com/modelingandsimulation/vsim/extension" xmlns:xsi="http://www.w3.org/2001/XMLSchema-instance" Name="testVirtualComponent" xsi:noNamespaceSchemaLocation="ims_config.xsd">
  <Equipment Name="firstEquipment">
    <Application Name="firstApplication">
      <DataExchange>
        <ANALOGUE>
          <ProducedData>
            <Signal Name="grp1_sig1" LocalName="signal1" ScaleFactor="1.5" Offset="0" PeriodUs="50000" />
            <Signal Name="grp1_sig2" LocalName="signal2" ScaleFactor="2" Offset="3.5" PeriodUs="50000" />
            <Signal Name="grp2_sig1" LocalName="signal3" ScaleFactor="0.5" Offset="-4.2" PeriodUs="60000" />
            <Signal Name="grp2_sig2" LocalName="signal4" ScaleFactor="-1.5" Offset="200" PeriodUs="60000" />
          </ProducedData>
        </ANALOGUE>
      </DataExchange>
    </Application>
  </Equipment>
</VirtualComponent>
